title,authors,year,journal,doi,labels,appears_in_multiple_labels,downloaded
Comparison of Spectroscopy-Based Methods and Chemometrics to Confirm Classification of Specialty Coffees,"Belchior, V. and Botelho, B.G. and Franca, A.S.",2022,Foods,10.3390/foods11111655,specialty_coffee,False,no
Specialty and regular coffee bean quality for cold and hot brewing: Evaluation of sensory profile and physicochemical characteristics,"Córdoba, N. and Moreno, F.L. and Osorio, C. and Velásquez, S. and Fernandez-Alduenda, M. and Ruiz-Pardo, Y.",2021,LWT,10.1016/j.lwt.2021.111363,specialty_coffee,False,no
"Coffee Drying and Processing Method Influence Quality of Arabica Coffee Varieties (Coffea arabica L.) at Gomma i and Limmu Kossa, Southwest Ethiopia","Firdissa, E. and Mohammed, A. and Berecha, G. and Garedew, W.",2022,Journal of Food Quality,10.1155/2022/9184374,solar_drying,False,no
A field survey on coffee beans drying methods of Indonesian small holder farmers,"Siagian, P. and Setyawan, E.Y. and Gultom, T. and Napitupulu, F.H. and Ambarita, H.",2017,IOP Conference Series: Materials Science and Engineering,10.1088/1757-899X/237/1/012037,solar_drying,False,no
Thermo-economic comparative of open-greenhouse and sun-patio coffee drying in the Sierra Mariscal Chiapas-México,"Santizo-Díaz, D. and Flores-Prieto, J.J.",2025,Case Studies in Thermal Engineering,10.1016/j.csite.2025.106072,solar_drying,False,no
Changes in physico-chemical characteristics of robusta coffee (Coffea canephora) during natural process using simple solar dryer,"Harijono, M.F.W. and Wulan, S.N. and Ali, D.Y. and Riza D.F.A. and Izza N. and Gustinasari K. and Maharsih I.K. and Sunarharum W.B. and Nurcholis M. and Dewanti B.S.D. and Widayanti V.T. and Mufidah E. and Qisthiya I. and Karadag D. and Idrus S. and Umakoshi H. and Lee Y.C. and Fatchurrahman D. and Zhu M. and Omwange K.A. and Addini T.",2024,BIO Web of Conferences,10.1051/bioconf/20249001003,solar_drying,False,no
Rice husk energy rotary dryer experiment for improved solar drying thermal performance on cherry coffee,"Bawa Susana, I.G. and Alit, I.B. and Okariawan, I.D.K.",2023,Case Studies in Thermal Engineering,10.1016/j.csite.2022.102616,solar_drying,False,no
Preliminary study of drying of natural coffee by cyclical pressure changes,"Parra-Coronado, A. and García-Navarrete, O.L. and Vanegas-Izquierdo, F.A. and Gamboa-Gamboa, J.A. and González-Mora, A.F. and Ramírez-González, D.A.",2020,DYNA (Colombia),10.15446/DYNA.V87N214.83414,solar_drying,False,no
Bioclimatic performance of wet coffee processing facilities: Conditions for workers and coffee,"Guerra García, L.M. and Osorio Hernández, R. and Saráz, J.A.O. and Carlo, J.C. and Damasceno, F.A.",2022,Revista Facultad Nacional de Agronomia Medellin,10.15446/RFNAM.V75N1.96247,coffee_processing,False,no
Enhancing the performance of conventional coffee beans drying with low-temperature geothermal energy by applying HPHE: An experimental study,"Gunawan, Y. and Margono, K.T. and Rizky, R. and Putra, N. and Faqih, R.A. and Hakim, I.I. and Setiadanu, G.T. and Suntoro, D. and Kasbi, S. and Nafis, S.",2021,Open Agriculture,10.1515/opag-2021-0053,mechanical_drying,False,no
"Effectiveness of a coffee drying process using solar dryers with a continuous air flow system powered by photovoltaic energy, in the San Martín region, Peru","Prada, Á. and Vela, C.P. and Bardález, G. and Saavedra, J.",2019,Informacion Tecnologica,10.4067/S0718-07642019000600085,mechanical_drying,False,no
Performance Analysis and Kinetic Modeling of Coffee Beans in Microwave Convective Dryer Integrated Photovoltaic System,"Kusmiyati, K. and Fudholi, A.",2022,Mathematical Modelling of Engineering Problems,10.18280/mmep.090427,mechanical_drying,False,no
Influence of drying air temperature on coffee quality during storage,"Peñuela-Martínez, A.E. and Sanz-Uribe, J.R. and Medina-Rivera, R.D.",2023,Revista Facultad Nacional de Agronomia Medellin,10.15446/rfnam.v76n3.104115,coffee_quality,False,no
"Effect of processing and drying methods on biochemical composition of coffee (Coffea arabica L.) varieties in Jimma Zone, Southwestern Ethiopia","Eshetu, E.F. and Tolassa, K. and Mohammed, A. and Berecha, G. and Garedew, W.",2022,Cogent Food and Agriculture,10.1080/23311932.2022.2121203,coffee_quality,False,no
Comparative analysis of coffee drying on quality with variations in dryers made solar collectors,"Siagian, P. and Napitupulu, F.H. and Ambarita, H. and Sihombing, H.V. and Siagian, H. and Rahim R. and Kurniawati H. and Radiansyah I.R.",2024,AIP Conference Proceedings,10.1063/5.0202116,coffee_quality,False,no
"Physical, Sensorial, and Physicochemical Characteristics of Arabica Coffee Dried under Two Solar Brightness Conditions","Peñuela-Martínez, A.E. and Hower-García, I.P. and Guerrero, A. and Agudelo-Laverde, L.M. and Betancourt-Rodríguez, H. and Martínez-Giraldo, J.",2023,Processes,10.3390/pr11103016,coffee_quality,False,no
Performance Evaluation of an Inflated Solar Dryer Integrated with Phase Change Materials for Enhanced Drying of Cherry Coffee,"Maryana, Y.E. and Saputra, D. and Priyanto, G. and Yuliati, K.",2025,International Journal of Design and Nature and Ecodynamics,10.18280/ijdne.200119,coffee_quality,False,no
Drying air temperature profile of independent hybrid solar dryer for agricultural products in respect to different energy supplies (a research note),"Yuwana, Y. and Silvia, E. and Sidebang, B. and Habazar T. and Yonariza null and Yulnafatmawita null and Mahdi null and Hayati D. and Arief I.",2020,IOP Conference Series: Earth and Environmental Science,10.1088/1755-1315/583/1/012033,drying_kinetics,False,no
Energy analysis of a hybrid solar dryer for drying coffee beans,"Suherman, S. and Widuri, H. and Patricia, S. and Susanto, E.E. and Sutrisna, R.J.",2020,International Journal of Renewable Energy Development,10.14710/ijred.9.1.131-139,energy_efficiency,False,no
Proposal for implantation of coffee drying greenhouse with parabolic cover and adapted modular structure,"Briceño-Martínez, B. and Castillo-Calderón, J. and Carrión-Jaura, R. and Díaz-Sinche, D.",2020,Ingenius,10.17163/ings.n24.2020.04,dryer_design,False,no
A data-driven approach to improve coffee drying: Combining environmental sensors and chemical analysis,"Jakkaew, P. and Yingchutrakul, Y. and Aunsri, N.",2024,PLoS ONE,10.1371/journal.pone.0296526,coffee_quality,False,no
Design of a Continuous Coffee Bean Solar Dryer,"Ambarita, H. and Munthe, H.K.J. and Hutagalung, T.",2020,Journal of Physics: Conference Series,10.1088/1742-6596/1542/1/012025,dryer_design,False,no
Free electricity tandem-twin-hybrid solar-biomass dryer increased the performance of coffee cherry drying,"YUWANA, Y. and SYAFNIL, S.",2025,Research in Agricultural Engineering,10.17221/98/2024-RAE,energy_efficiency,False,no
Analysis of temperature and velocity distributions in a solar drying box coffee beans,"Siagian, P. and Napitupulu, F.H. and Setyawan, E.Y. and Siagian, L. and Napitupulu, R.A.M. and Ambarita, H.",2018,IOP Conference Series: Materials Science and Engineering,10.1088/1757-899X/420/1/012035,drying_kinetics,False,no
Drying gayo coffee under natural processing by using modified Hohenheim solar tunnel dryer in Gayo highland,"Khathir, R. and Yunita, Y. and Agustina, R. and Jayanti, D.S. and Siagian, A.",2024,IOP Conference Series: Earth and Environmental Science,10.1088/1755-1315/1297/1/012018,mechanical_drying,False,no
Performance Investigation of an Inflatable Solar Dryer with Steel-Can Solar Air Heater for Drying Coffee and Corn,"Oria, C.L. and Palconit, E.V.",2022,"Engineering, Technology and Applied Science Research",10.48084/etasr.4966,mechanical_drying,False,no
The Effect of Varying the Air Flow in a Solar Collector on the Quality of Arabica Coffee Beans,"Siagian, P. and Napitupulu, F.H. and Ambarita, H. and Sihombing, H.V. and Sibagariang, Y.P. and Siagian, H.S.",2024,Fluids,10.3390/fluids9030075,coffee_quality,False,no
Changes in fatty acids profile and sucrose concentration of coffee beans during drying process,"Largo-Avila, E. and Suárez-Rodríguez, C.H. and Maya, J.C. and Ciro-Velásquez, H.J. and Chejne, F.",2023,Journal of Food Process Engineering,10.1111/jfpe.14385,coffee_quality,False,no
Effect of altitude on coffee (Coffea arabica L.) quality: Comparison between mechanical and traditional drying,"Guevara-Sánchez, M. and Bernales del Águila, C.I. and Saavedra-Ramírez, J. and Owaki-López, J.J.",2019,Scientia Agropecuaria,10.17268/sci.agropecu.2019.04.07,solar_drying,False,no
LOW COST TELEMONITORING TECHNOLOGY OF SEMISPHERICAL SOLAR DRYER FOR DRYING ARABICA COFFEE BEANS,"Pramono, E.K. and Karim, M.A. and Fudholi, A. and Bulan, R. and Lapcharoensuk, R. and Sitorus, A.",2022,INMATEH - Agricultural Engineering,10.35633/inmateh-66-34,dryer_design,False,no
Investigating the Performance and Optimization of Solar Coffee Drying Technologies—A Systematic Review,"Meja, E.M. and Dubbe, S.K. and Bekele, A. and Wolde, K.F. and Adaramola, M.S.",2025,Journal of Food Processing and Preservation,10.1155/jfpp/7907660,solar_drying,False,no
Physical and sensory quality of coffee dried in three prototypes of greenhouse solar dryers,"de Jesús Huamán-Murillo, M. and Garcia, S.M.M. and Murillo-Baca, S.M. and Ponce-Rosas, F.C. and Fuentes-Meza, M.J.",2024,Revista de la Facultad de Agronomia,10.47280/RevFacAgron(LUZ).v41.n2.02,solar_drying,False,no
Performance evaluation of diminutive solar dryer for drying of green coffee beans: In Ethiopian highlands,"Kebede, A.Y. and Tigabu, M.T. and Admase, A.T. and Bezie, A.J.",2025,Case Studies in Thermal Engineering,10.1016/j.csite.2024.105653,solar_drying,False,no
Coffee Drying Using a Combination of Solar and Electric Heaters Utilizing PCM as a Thermal Energy Storage,"Fauzi, M.B. and Kosasih, E.A. and Putra, G.J.P.",2025,Journal of Physics: Conference Series,10.1088/1742-6596/3103/1/012002,solar_drying,False,no
Controlling temperature using proportional integral and derivative control algorithm for hybrid forced convection solar dryer,"Arifin, M.A. and Pangaribuan, P. and Pramudita, B.A. and Megantoro, P.",2024,International Journal of Electrical and Computer Engineering,10.11591/ijece.v14i1.pp239-247,dryer_design,False,no
"Harmonizing Drying Time, Layer Thickness, and Drier Zones for Drying Kinetics: Quality and Safety of Solar Tunnel-Dried Wet-Processed Parchment Coffee (Coffea arabica L.)","Abdissa, Z.K. and Tola, Y.B. and Taye, A.H. and Mohammed, H.H.",2023,International Journal of Food Science,10.1155/2023/6677592,coffee_quality,False,no
Comparative study of mathematical and experimental models of coffee bean drying rate in a solar dryer simulator,"Sihombing, H.V. and Ambarita, H. and Silalahi, J.F. and Ambarita H. and Selvasembian R. and Fachrudin H.T. and Huda A.",2024,E3S Web of Conferences,10.1051/e3sconf/202451903035,solar_drying,False,no
Determination of appropriate effective diffusivity for different food materials,"Khan, M.I.H. and Kumar, C. and Joardder, M.U.H. and Karim, M.A.",2017,Drying Technology,10.1080/07373937.2016.1170700,drying_kinetics,False,no
Individual and interactive effect of ultrasound pre-treatment on drying kinetics and biochemical qualities of food: A critical review,"Pandiselvam, R. and Aydar, A.Y. and Kutlu, N. and Aslam, R. and Sahni, P. and Mitharwal, S. and Gavahian, M. and Kumar, M. and Raposo, A. and Yoo, S. and Han, H. and Kothakota, A.",2023,Ultrasonics Sonochemistry,10.1016/j.ultsonch.2022.106261,drying_kinetics,False,no
Improving Mechanical Coffee Drying with Recycled Insulating Materials: A Thermal Efficiency and Economic Feasibility Analysis,"Cruz-Ospina, V. and Duque-Dussán, E. and Sanz-Uribe, J.R.",2026,Foods,10.3390/foods15020367,drying_kinetics,False,no
Exploring the impacts of postharvest processing on the microbiota and metabolite profiles during green coffee bean production,"De Bruyn, F. and Zhang, S.J. and Pothakos, V. and Torres, J. and Lambot, C. and Moroni, A.V. and Callanan, M. and Sybesma, W. and Weckx, S. and De Vuyst, L.",2017,Applied and Environmental Microbiology,10.1128/AEM.02398-16,coffee_processing,False,no
Protein profiles and physiological performance of coffee seeds subjected to different processing and drying methods,"Taveira, J.H.S. and da Rosa, S.D.V.F. and Borém, F.M. and Giomo, G.S. and Saath, R.",2012,Pesquisa Agropecuaria Brasileira,10.1590/S0100-204X2012001000014,coffee_processing,False,no
Simulation of a thermal environment in two buildings for the wet processing of coffee,"Osorio-Hernandez, R. and Guerra-Garcia, L.M. and Ferreira-Tinôco, I.D.F. and Osorio-Saraz, J.A. and Aristizábal-Torres, I.D.",2015,DYNA (Colombia),10.15446/dyna.v82n194.49526,coffee_processing,False,no
Monitoring moisture content in parchment coffee beans during drying using Fourier Transform near infrared (FT-NIR) spectroscopy: A dataset for calibrating chemometric-based models for moisture prediction,"Ordoñez-Lozano, S. and Collazos-Escobar, G.A. and Bahamón-Monje, A.F. and Gutiérrez-Guzmán, N.",2025,Data in Brief,10.1016/j.dib.2025.111436,drying_kinetics,False,no
Effect of the postharvest processing method on the biochemical composition and sensory analysis of arabica coffee,"Rodriguez, Y.F.B. and Guzman, N.G. and Hernandez, J.G.",2020,Engenharia Agricola,10.1590/1809-4430-ENG.AGRIC.V40N2P177-183/2020,coffee_processing,False,no
POSTHARVEST EFFECTS ON THE PHYSICAL QUALITY AND SENSORY CHARACTERISTICS OF COFFEA CANEPHORA,"Velásquez, S. and Banchón, C. and Farfán, D. and Guerrero-Casado, J.",2023,"Acta Scientiarum Polonorum, Technologia Alimentaria",10.17306/J.AFS.2023.1181,coffee_quality,False,no
CHANGES IN TEXTURAL PROPERTIES AND COLOR DUE TO THE PROCESSING METHOD OF GREEN COFFEA ARABICA,"Poláková, K. and Bobková, A. and Demianová, A. and Belej, Ľ. and Jurčaga, L. and Bobko, M. and Mesárošová, A. and Žiak, M.",2022,"Journal of Microbiology, Biotechnology and Food Sciences",10.55251/jmbfs.9458,coffee_quality,False,no
EXPLORING THE SOIL-ASSOCIATED BACTERIAL MICROBIOME OF COFFEE PLANTATIONS IN DIFFERENT REGIONS OF COLOMBIA: A METABARCODING APPROACH,"Gómez-Godínez, L.J. and Ochoa, V. and Faggioli, V. and Cristancho, M.",2024,Tropical and Subtropical Agroecosystems,10.56369/tsaes.5196,coffee_general,False,no
"Agricultural Productivity and Multidimensional Poverty Reduction in Colombia: An Analysis of Coffee, Plantain, and Corn Crops","Betancourt, J.A. and Florez-Yepes, G.Y. and Garcés-Gómez, Y.A.",2024,Earth (Switzerland),10.3390/earth5040032,coffee_general,False,no
Increasing the Additional Value of Coffee Cultivation Results in Brebes Regency with a Value Chain Analysis Approach,"Rastuti, U. and Yunanto, A. and Jatmiko, D.P.",2022,Quality - Access to Success,10.47750/QAS/23.188.13,coffee_general,False,no
Agricultural zoning of Coffea arabica in Brazil for current and future climate scenarios: implications for the coffee industry,"Lorençone, J.A. and de Oliveira Aparecido, L.E. and Lorençone, P.A. and Torsoni, G.B. and de Lima, R.F. and da Silva Cabral de Moraes, J.R. and de Souza Rolim, G.",2025,"Environment, Development and Sustainability",10.1007/s10668-023-04066-3,coffee_general,False,no
Efficiency Investigation of Coffee Production Waste Drying by Filtration Method,"Ivashchuk, O.S. and Atamanyuk, V.M. and Chyzhovych, R.A.",2024,Journal of Engineering Sciences (Ukraine),10.21272/jes.2024.11(2).f2,drying_kinetics,False,no
"Investigation of Thin-Layer Drying of Coffee Beans Using a Double-Condenser Compression Refrigeration System: Effects of Air Mass Flux, Specific Humidity and Drying Temperature","Dzaky, M.I. and Kosasih, E.A. and Hakim, I.I. and Zikri, A.",2023,Journal of Advanced Research in Fluid Mechanics and Thermal Sciences,10.37934/arfmts.106.1.90103,coffee_quality,False,no
Development and validation of a heated drying air diffusion system to optimize rotary dryers and final coffee quality,"Coradi, P.C. and Martens, S. and Rodrigues, H.E. and Leal, A.F. and Da Costa, D.R. and Saath, R. and Borém, F.M.",2021,PLoS ONE,10.1371/journal.pone.0251312,coffee_quality,False,no
Effect of temperature on drying kinetics and quality attributes of coffee beans during hot air drying,"Fernando, A.J. and Amaratunga, K.S.P. and Dan, D. and THKR De, S.",2025,Journal of the National Science Foundation of Sri Lanka,10.4038/jnsfsr.v53i3.12590,coffee_quality,False,no
PHOTOVOLTAIC PLANT TO SUPPLY ENERGY FOR AN ELECTRIC COFFEE DRYER - ENERGY COSTS AND COMPENSATION,"Konopatzki, E.A. and de Oliveira, C.L. and Marangoni, F. and Edwiges, T. and Christ, D.",2023,Engenharia Agricola,10.1590/1809-4430-Eng.Agric.v43nepe20220150/2023,energy_efficiency,False,no
Price and quality of coffee (Coffea arabica L.) dried using air dehumidified by convection,"Konopatzki, E.A. and Christ, D. and Coelho, S.R.M. and Demito, A. and Werncke, I. and Camicia, R.G.M.",2019,Engenharia Agricola,10.1590/1809-4430-Eng.Agric.v39n5p649-658/2019,coffee_quality,False,no
Sensory quality of coffea arabica l. Genotypes influenced by postharvest processing,"Barbosa, I.P. and de Oliveira, A.C.B. and Rosado, R.D.S. and Sakiyama, N.S. and Cruz, C.D. and Pereira, A.A.",2019,Crop Breeding and Applied Biotechnology,10.1590/1984-70332019v19n4a60,coffee_general,False,no
Coffee beans industrial vibrofluidized bed drying optimization (coffea arabica L.),"Ventura-Cruz, S. and Ramírez-Segura, O. and Flores-Alamo, N. and Ramírez-Gerardo, M. and Rodríguez-Ramírez, E.",2019,Revista Mexicana de Ingeniera Quimica,10.24275/uam/izt/dcbi/revmexingquim/2019v18n2/Ventura,mechanical_drying,False,no
Thin-layer drying of parchment Arabica coffee by controlling temperature and relative humidity,"Phitakwinai, S. and Thepa, S. and Nilnont, W.",2019,Food Science and Nutrition,10.1002/fsn3.1144,drying_kinetics,False,no
Microstructure and reconstitution of freeze-dried gum Arabic at a range of concentrations and primary drying temperatures,"Malik, N. and Muttakin, S. and Lopez-Quiroga, E. and Watson, N.J. and Fryer, P.J. and Bakalis, S. and Gouseti, O.",2020,Food Hydrocolloids,10.1016/j.foodhyd.2020.105712,mechanical_drying,False,no
"Quality of arabic coffee under different processing systems, drying methods and altitudes","Do Carmo, K.B. and Do Carmo, J.C.B. and Krause, M.R. and Moreli, A.P. and Lo Monaco, P.A.V.",2020,Bioscience Journal,10.14393/BJ-v36n4a2020-47890,coffee_quality,False,no
Activation Energy Analysis of Coffee Beans Drying Using Double Condenser Refrigeration System,"Dzaky, M.I. and Kosasih, E.A. and Fauzi, M.B. and Prabowo, A.T. and Zikri, A. and Wibowo F.C. and Taufik null and Samsudin A. and Budi E. and Indrasari W. and Nasbey H. and Prayitno T.B. and Bakri F. and Muliyati D. and Sanjaya L.A.",2022,Journal of Physics: Conference Series,10.1088/1742-6596/2377/1/012058,coffee_quality,False,no
Quality of natural coffee dried under different temperatures and drying rates,"Borém, F.M. and Isquierdo, E.P. and Alves, G.E. and Ribeiro, D.E. and Siqueira, V.C. and Taveira, J.H.S.",2018,Coffee Science,10.25186/cs.v13i2.1410,coffee_quality,False,no
The influence of hot-air mechanical drying on the sensory quality of specialty Colombian coffee,"Largo-Avila, E. and Suarez-Rodríguez, C.H. and Montero, J.L. and Strong, M. and Juan, O.-A.",2023,AIMS Agriculture and Food,10.3934/AGRFOOD.2023042,coffee_quality,False,no
Efect of lnf (Cna-cnb) enzyme complex in the drying process and the coffee quality,"Santos, D.F. and Franco Junior, K.S. and da Silva, C.H. and Neto, J.F.D.S. and Paiva, L.C. and Brigante, G.P.",2020,Coffee Science,10.25186/.v15i.1677,coffee_drying_stage,False,no
Effect of spray-drying conditions on moisture content and particle size of coffee extract in a prototype dryer,"Villegas-Santiago, J. and Gómez-Navarro, F. and Domínguez-Niño, A. and García-Alvarado, M.A. and Salgado-Cervantes, M.A. and Luna-Solano, G.",2020,Revista Mexicana de Ingeniera Quimica,10.24275/rmiq/Proc767,mechanical_drying,False,no
Influence of different temperatures and airflows on drying of natural and pulped coffee,"Alves, G.E. and Borém, F.M. and Andrade, E.T. and Isquierdo, E.P. and Siqueira, V.C. and Dias, C.A.",2020,Engenharia Agricola,10.1590/1809-4430-ENG.AGRIC.V40N2P192-200/2020,coffee_quality,False,no
Enhancing rotary dryer efficiency: Adjusting blower speed for optimal temperature stability in coffee bean drying,"Syamsiana, I.N. and Nafisah, N. and Suma, A.D.W. and Fiernaningsih, N. and Amalia, R.N. and Nurwicaksana, W.A.",2025,MethodsX,10.1016/j.mex.2025.103477,drying_kinetics,False,no
"Comparative Life Cycle Assessment (LCA) in the Agri-Food Industry, Focusing on Organic and Conventional Coffee","Hasan, Y. and Roy, P. and Abbassi, B.",2024,Sustainability (Switzerland),10.3390/su162410819,coffee_processing,False,no
Endocarp analysis of a traditional variety of colombian coffee,"Muñoz, M. and Roa, M. and Correa, R.",2019,Coffee Science,10.25186/cs.v14i2.1572,coffee_quality,False,no
Comparative analysis of drying coffee beans using microwave and conventional oven,"Muñoz-neira, M.J. and Roa-ardila, M.F. and Correa-celi, C.R.",2020,Revista Facultad de Ingenieria,10.17533/udea.redin.20191151,drying_kinetics,False,no
Economic analysis of low-temperature grain drying,"Santana, P.A. and de Carvalho Lopes, D. and Neto, A.J.S.",2019,Emirates Journal of Food and Agriculture,10.9755/ejfa.2019.v31.i12.2040,energy_efficiency,False,no
Modeling effectiveness analysis of momentum and heat transfer in a fixed bed silo-dryer through computational fluid-dynamics,"Mateus, F.L.B. and Júnior, I.P.",2021,Coffee Science,10.25186/.V16I.1902,drying_kinetics,False,no
Physiological and sensorial quality of arabica coffee subjected to different temperatures and drying airflows,"Alves, G.E. and Borém, F.M. and Isquierdo, E.P. and Siqueira, V.C. and Cirillo, M.Â. and Pinto, A.C.F.",2017,Acta Scientiarum - Agronomy,10.4025/actasciagron.v39i2.31065,coffee_quality,False,no
Experimental Analysis and Numerical Simulation of Coffee Bean Drying in Packed Beds with Different Coffee Bean Stack Height,"Fauzi, M.B. and Kosasih, E.A. and Dzaky, M.I. and Nasution, G.G. and Zikri, A.",2025,Journal of Advanced Research in Fluid Mechanics and Thermal Sciences,10.37934/arfmts.128.2.122138,drying_kinetics,False,no
"Influence of Drying Methods on the Post-Harvest Quality of Coffee: Effects on Physicochemical, Sensory, and Microbiological Composition","Abreu, D.J.M.D. and Lorenço, M.S. and Machado, G.G.L. and Silva, J.M. and Azevedo, E.C.D. and Carvalho, E.E.N.",2025,Foods,10.3390/foods14091463,solar_drying,False,no
Improving Coffee Bean Drying Performance Using Polydryer (Dryer Assisted with Superabsorbent Polymer),"Abidin, A.Z. and Steven, S. and Yemensia, E.V. and Satyodriyani, K.R. and Syahriani, W.F. and Abidin, T. and Putra, R.P.",2024,International Journal of Chemical Engineering,10.1155/2024/1559845,drying_kinetics,False,no
The influence of natrural fermentation on coffee drink quality,"Pereira, L.F.B. and Franco Junior, K.S. and Barbosa, C.K.R.",2020,Coffee Science,10.25186/.v15i.1673,coffee_processing,False,no
Physical and sensorial quality of arabica coffee cultivars submitted to two types of post-harvesting processing,"Alixandre, R.D. and Alixandre, F.T. and de Lima, P.A.M. and Fornazier, M.J. and Krohling, C.A. and Do Amaral, J.F.T. and Guarçoni, R.C. and da Silva Dias, R. and Venturini, C.F. and Macette, H.A. and Zandonadi, C.U. and Viçosi, D.B.",2023,Coffee Science,10.25186/.v18i.2081,coffee_processing,False,no
Simulation of temperature and air flow distribution in coffee drying chamber using low enthalpy geothermal energy resource with thermosiphon technology,"Hakim, I.I. and Palupi, I.D. and Putra, N. and Ariyadi H.M. and Indarto null and Kamal S. and Saptoadi H. and Deendarlianto null",2024,AIP Conference Proceedings,10.1063/5.0188419,drying_kinetics,False,no
The effect of drying temperature on cup quality of coffee subjected to mechanical drying,"Sandeep, T.N. and Channabasamma, B.B. and Gopinandhan, T.N. and Nagaraja, J.S.",2021,Journal of Plantation Crops,10.25081/jpc.2021.v49.i1.7059,coffee_quality,False,no
Mathematical modelling and immediate and latent quality of natural immature coffee under different drying conditions,"de Andrade, E.T. and Lemos, I.A. and Dias, C.A. and Rios, P.A. and Borém, F.M.",2019,Engenharia Agricola,10.1590/1809-4430-Eng.Agric.v39n5p630-638/2019,drying_kinetics,False,no
COFFEE DRYER WITH DEHYDRATED AIR: A TECHNICAL AND ECONOMIC VIABILITY ANALYSIS,"Konopatzki, E.A. and Christ, D. and Coelho, S.R.M. and Demito, A. and Werncke, I. and da M. Camicia, R.G.",2022,Engenharia Agricola,10.1590/1809-4430-Eng.Agric.v42n4e20210003/2022,coffee_quality,False,no
Analysis on the Performance of Designed Fluidized Bed Dryer for Drying Coffee Beans,"Konsil, K.K. and Sazali, N. and Kadirgama, K. and Harun, W.S.W. and Zainol, N.",2023,Journal of Advanced Research in Applied Sciences and Engineering Technology,10.37934/araset.31.1.99109,drying_kinetics,False,no
Quality of natural and pulped coffee as a function of temperature changes during mechanical drying,"de Oliveira, P.D. and Biaggioni, M.A.M. and Borém, F.M. and Isquierdo, E.P. and de Oliveira Vaz Damasceno, M.",2018,Coffee Science,10.25186/cs.v13i4.1435,coffee_quality,False,no
Comparative analysis of heating efficiency in a coffee bean dryer machine using one and two thermoelectric peltier modules,"Mustafa, M.M. and Khalid, F. and Sariman, M.Z. and Aminordin, A. and Shafie, A.M.M.",2025,IOP Conference Series: Earth and Environmental Science,10.1088/1755-1315/1535/1/012012,drying_kinetics,False,no
Thermal design of 5 kg capacity coffee bean dryer simulator using Geothermal energy,"Hendrarsakti, J. and Firmansyah, M.R.",2019,IOP Conference Series: Earth and Environmental Science,10.1088/1755-1315/254/1/012019,drying_kinetics,False,no
